{
  "schemaVersion": "release-ops/provider/v2",
  "configSchemaVersion": "release-ops/provider-config/example-performance/v1",
  "configSchema": "config.schema.json",
  "id": "example-performance-provider",
  "category": "performance",
  "installed": false,
  "docs": "docs/providers/example-performance.md",
  "requiredSecrets": {},
  "runtimeFiles": [],
  "capabilities": ["configure", "audit", "requiredSecrets", "buildHooks", "scheduledIngest"]
}
