{
  "schemaVersion": "release-ops/provider/v2",
  "configSchemaVersion": "release-ops/provider-config/example-vulnerability/v1",
  "configSchema": "config.schema.json",
  "id": "example-vulnerability-provider",
  "category": "vulnerability",
  "installed": false,
  "docs": "docs/providers/example-vulnerability.md",
  "requiredSecrets": {},
  "runtimeFiles": [],
  "capabilities": ["configure", "audit", "requiredSecrets", "buildHooks", "scheduledIngest", "incidentIntake", "resolve"]
}
